URL,Product Name,Price,Overall Rating,Overall # of Reviews,User,Location,# of User Reviews,User Rating,Rating Title,Rating Description,Sizing
https://www.shopbop.com/reviews/brand?folderID=5090&baseIndex=0,Rosa Laced Mini Dress,$278.00,5,1,Leanne14,Ohio,16,5,Zimmermann Sale,"I LOVE the Rosa collection and now own several items.  However, it always amazes me how much the price drops- if you wait, you risk losing out on your size, but I always wait.  I actually paid less for this elsewhere.  That being said- this is lovely and feminine.  The linen is beautiful as are all the details.  Zimmermann really does lovely pieces.  TTS.  I find Zimmermann runs a tad small. I would normally be a 0P or OO but order a 0.  Fits perfectly no matter the item.  Sizing consistency is worth paying a little extra IMO.",True to Size / As Expected
https://www.shopbop.com/reviews/brand?folderID=5090&baseIndex=0,Postcard Crochet Hat,$112.20,5,1,I_WEAR_PRADA,washington DC,30,5,Absolutely adorable!,"This hat is so practical and goes with any summer style. I missed it at My Theresa, where it was sold out in a day, for more money. So glad I found it here! It's light, packable and super stylish.  ",Larger than Expected
https://www.shopbop.com/reviews/brand?folderID=5090&baseIndex=0,Postcard Mini Dress,$358.00,3,1,mrf795,United States,1,3,Was sent the wrong size :(,"This dress is gorgeous! I ordered it in a size 1 (4-6), then re-ordered it in a size 2 (6-8), and it arrived in a bag labeled size 2 but the dress was tagged size 3 which unfortunately was too big. Super bummed because I wanted this for a vacation. I typically wear a size 6, denim 28. The 1 fit good in the shoulders, but was snug around the hips, was hoping for a slightly looser fit w/ the 2 because the dress has no stretch. ",
https://www.shopbop.com/reviews/brand?folderID=5090&baseIndex=0,Rosa Plunge Bow Mini Dress,$486.50,5,1,H.Chi,CA,1,5,So cute!,"Ugh, I wish this worked out for me! My usual size was sold out, but I ordered the smaller size anyway, hoping it would run a little big - def not the case haha. It runs true to size. I have no boobs and no hips, but this gives you such a good shape! Hopefully the next size up restocks in time to wear it to my beachy engagement shoot. It's truly a flattering dress!! 

**For those with larger chests, I don't think this would give you much support. ",True to Size / As Expected
https://www.shopbop.com/reviews/brand?folderID=5090&baseIndex=0,Silk Wrap Midi Dress,$630.00,2,2,kfenn,California,1,1,Hard to care for fabric...,"I received this $600+ dress in a 9x12"" plastic bag - folded and wrinkled. I wanted to love this dress, but had to return it because of the ""how to care for"" instructions. Very delicate fabric.",
https://www.shopbop.com/reviews/brand?folderID=5090&baseIndex=0,Silk Wrap Midi Dress,$630.00,2,2,Milrockee,"Brooklyn, NY",143,3,Zimmermann Silk Wrap Dress,"Meh, fit wasn't that flattering and the silk crepe felt and looked almost velveteen. ",True to Size / As Expected
https://www.shopbop.com/reviews/brand?folderID=5090&baseIndex=0,Estelle Billow Mini Dress,$315.00,3,1,MA_NA,"Toronto, Canada",13,3,Larger than expected,"I ordered this dress in a 0, my usual Zimmerman size, but it was far too large and overpowered my short frame (5'2). Unfortunately the 00 is sold out, so I will be returning.",Larger than Expected
https://www.shopbop.com/reviews/brand?folderID=5090&baseIndex=0,Silk Wrap Mini Dress,$416.50,5,1,ashloo,los angeles,1,5,love this dress!,"I've been eyeing this Zimmerman dress for ages & when the lavender color popped up on the website, I had to bite the bullet. The dress is gorgeous and luxurious, so smooth and soft on the skin -- it's almost like wearing a bath robe out, lol. Do take note that if you are large-chested like me, this dress is on the more revealing side because of the plunge neckline & wrap! 

I am 5'6"" and v curvy, but the mini skirt was not too short on me like so many other dresses are. I was actually really comfortable in it.  I got a 1 and usually wear sizes 4-6.",True to Size / As Expected
https://www.shopbop.com/reviews/brand?folderID=5090&baseIndex=0,Silk Cowl Blouse,$225.00,5,1,Romana,Chicago ,338,5,As per Zimmerman...,"Statement blouse that can be dressed up or down. It is very flattering on, even with the bellowed sleeves (which I normally avoid). Its beautiful, soft petal pink color complements every skin tone, and it has an elegant fit. ",True to Size / As Expected
https://www.shopbop.com/reviews/brand?folderID=5090&baseIndex=0,Brightside Wrap Midi Dress,$480.00,2,1,Romana,Chicago ,338,2,Casual pretty,"I loved the print and silk material, but the sizing was off (not unusual with Zimmermann). Bought it in two sizes (0, 1), and the chest cavity wouldn't even fit in the top portion. The waist/hip area was right, but the chest area was extremely small (not even flat-chested women could fit in it, I'm sure). ",Smaller than Expected
https://www.shopbop.com/reviews/brand?folderID=5090&baseIndex=0,Reversible Linen Bucket Hat,$85.00,5,1,belaissima,Santa Barbara ,7,5,Not a bucket hat person but I am now.,"This hat is stellar. Its reversible which is a huge plus to switch from the fun print to the simple camel linen color. It goes with everything and is super flattering. It fits great and is very durable (was great for a beach day, and also perfect for a long mountain hike). My boyfriend steal this hat from time to time because it's so good. Everyone loves it! ",True to Size / As Expected
https://www.shopbop.com/reviews/brand?folderID=5090&baseIndex=0,Silk Wrap Mini Dress,$357.00,5,1,Romana,Chicago ,338,5,Pretty in pink and blue,"This is such a beautiful cornflower-colored summer dress. I am a size 1 in Zimmerman (the line does run small), but bought this in size 2 in cornflower (as it was the only size left, and I figured it could work bc it's a wrap dress), and size 0 in the magenta (that, too, was all that was left). Both fit elegantly, and the colors and material are beautiful. They look great with both flat sandals and heels. I wish shop bop had it available in the dark blue color (stunning).",Smaller than Expected
https://www.shopbop.com/reviews/brand?folderID=5090&baseIndex=0,Strap Sandals,$135.00,2,1,SaraSeattle777,Seattle,21,2,"Boxy, wide sandals ",These sandals were not very cute.,Larger than Expected
https://www.shopbop.com/reviews/brand?folderID=5090&baseIndex=0,Bellitude Midi Dress,$128.00,4,1,Insider,"New York, NY  ",98,4,so pretty,This dresses is so pretty and perfect! I'm giving it 4 stars because it's snug on me at the bust (I'm a DD). ,Smaller than Expected
https://www.shopbop.com/reviews/brand?folderID=5090&baseIndex=0,Strap Sandals,$90.00,5,1,Milly Milly,Taiwan,8,5,SO comfortable,"I'm so happy i got these on sale! 'Cos they are definately my new favorite! Very well made & comfortable to walk in because the leather is so soft, no funny smell. It's easy to wear for a night out or casual day out. I'm usually 6.5 US, and 37 EU was perfect in these!",True to Size / As Expected
https://www.shopbop.com/reviews/brand?folderID=5090&baseIndex=15,Freja Embroidered High Waist Shorts,$187.50,5,1,alexxandra,"San Francisco, CA ",23,5,IN LOVE,"Obsessed with these shorts- they are true to size, and a very flattering fit. Can't wait to wear!",True to Size / As Expected
https://www.shopbop.com/reviews/brand?folderID=5090&baseIndex=15,Peggy Multi Short Dress,$477.00,5,1,ZimmermannIsBae,FL,4,5,Beautiful Embroidery & Workmanship,"Loved this dress. I am transitioning in sizes at the moment (lol), so I tried sizes 0 & 1. Being petite (5'1'') with a short, smaller torso & ever-widening, disproportionate hips...the size 0 fit my upper perfectly. However, due to some health/tummy issues that I have going on, the bottom was so well tailored that it accentuated my immaculately conceived (lol) faux baby bump. This also made the dress length shorter on me, perhaps 4"" above my knees. Meanwhile , the size 1 fit my lower region comfortably, having a lengthening effect so that it fell past my knees. However, the size 1 was completely drowning out my upper & waist, too oversized. I considered having the size 1 tailored via my Nordstrom CC perks. Ultimately, unsure of how long this global pandemic will have businesses closed(especially close-proximity services such as tailoring), I was too afraid to risk it with the cost & the limited return window. sad face emoji. I totally recommend this dress to anyone, nevertheless.",True to Size / As Expected
https://www.shopbop.com/reviews/brand?folderID=5090&baseIndex=15,Bonita Button Through Romper,$159.00,5,1,ZimmermannIsBae,FL,4,5,Quintessential Zimmermann Floral Romper,"Beautiful print with gorgeous, warm florals (exactly as photo). 

Sizing: Seems pretty generous, but closer to true-to-size. Perfect for petite, pear shapes. (Reference: I am 5'1'' with a 30DD upper, short torso, very distended abdomen (health issues), & newly disproportionately bodacious hips.)

Fabric tailoring is simple & perfect, as the comfortable, lightweight fabric somehow effortlessly shapes your waistline. The bottom obviously flares out, to accommodate your lower & is quite ample & voluminous. 

Length: It is quite short, as expected perhaps, even on my short frame. I would recommend wearing some spandex, short boy shorts underneath to avert any wardrobe malfunctions.

Value: In my honest opinion, in spite of this romper being beautiful, flattering, & a perfect sampling of the Zimmermann design house, it does seem somewhat overpriced. It is unlined; the lightweight fabric is somewhat see-thru (although the floral print helps to conceal) & seems insubstantial.
",True to Size / As Expected
https://www.shopbop.com/reviews/brand?folderID=5090&baseIndex=15,Ninety Six Pleated Slip Dress,$347.50,5,1,marns89,"NYC,NY",184,5,Prettiest printed dress,"Zimmermann dresses are the BEST. This dress runs true to size, but is a little full on the bottom- if you're curvy or have hips/a butt, this is a great dress for you! If you're more narrow, I'd size down. I wear an 8 typically and ordered this in a size 2- perfect fit. Sometimes in their more narrow or fitted dresses I need a 3, but the 2 here was perfect. Great weight for Spring/Summer weddings. ",Larger than Expected
https://www.shopbop.com/reviews/brand?folderID=5090&baseIndex=15,Swallow Ring,$84.00,4,1,perle36,"Switzerland, Zurich",104,4,Nice ring,"Wanted to give it as a gift, ended up keeping it for myself.",True to Size / As Expected
https://www.shopbop.com/reviews/brand?folderID=5090&baseIndex=15,Turkish Towel,$37.00,5,1,Amal Vulpe,Qatar,95,5,A big towel ,"Love this towel is definitely a piece of art I was eyeing to buy it for a while and now its on sale it was time , am happy to own this towel my only issue the white part is not white is more to the pink and looks like the dying colours leaked on the white part but it still good looking towel and very light . ",
https://www.shopbop.com/reviews/brand?folderID=5090&baseIndex=15,Bayou Flare Dress,$223.50,5,1,Ilinamarina,"Surgut, Russia",2,5,Lovely,"Beautiful dress! Coloring, fabric, style - all very gentle, feminine. The size of the 1 me licked usually I take 6",True to Size / As Expected
https://www.shopbop.com/reviews/brand?folderID=5090&baseIndex=15,Rainbow Trainers,$105.00,5,1,Lefty 1953,Harrison tn,1,5,Love These Sneakers,I wear a size 8. I did see where it was noted that these sneakers run slightly small. The size 38 fit as well as my other sneakers. I am very pleased with these sneakers and love the blue colors. Something different and unique.,
https://www.shopbop.com/reviews/brand?folderID=5090&baseIndex=15,Cowl Tank,$206.50,5,1,Romana,Chicago ,338,5,Elegant,"Beautiful fit, color, and style. Super comfortable top, but with a polished, structured look.",True to Size / As Expected
https://www.shopbop.com/reviews/brand?folderID=5090&baseIndex=15,Double Buckle Suiting Belt,$96.00,5,1,Laloosh,"Dubai, UAE",15,5,Lovee it! ,Great piece that transforms your look! ,
https://www.shopbop.com/reviews/brand?folderID=5090&baseIndex=15,Pouch Bag,$65.00,3,1,robotrex,"Toronto, ON",5,3,Not as expected,"Was a bit disappointed when this item arrived! I had high hopes for it, but it was too unstructured for me. It made me feel like it was a coin purse that I should have been hiding under a cloak. Very nice quality, though. Sadly, it will be returned.",
https://www.shopbop.com/reviews/brand?folderID=5090&baseIndex=15,Bowie Off Shoulder Dress,$357.00,5,1,Rupi,Maine,1,5,unbelievable," This Bowie dress is at the most beautiful dress I have ever owned.  I love my other Zimmerman dress, the Ninety-Six Pintuck Mini but Bowie off shoulder hits it out of the ball park. It's stunning detail, beautiful fabric and sexy feminine look is just awesome!",True to Size / As Expected
https://www.shopbop.com/reviews/brand?folderID=5090&baseIndex=15,Heathers Off Shoulder Dress,$255.00,3,1,dianaathena,Athens GA,6,3,Watch the Waist Band,"I adored this dress and I was so excited to try it on. But be wary of the waistband, as it is a loop eyeleting there is no give and even if it fits perfectly everywhere else, if you are the smallest bit off at the waist it bunches and will not smooth out. I was so sad to return it but I knew the Size up would swallow me at the bust.",
https://www.shopbop.com/reviews/brand?folderID=5090&baseIndex=15,Plisse Short Dress,$212.00,4,1,SWMT,NEW YORK,5,4,elegant and beautiful,I purchased this dress for my city hall wedding ceremony. It is super photogenic!,True to Size / As Expected
https://www.shopbop.com/reviews/brand?folderID=5090&baseIndex=15,Separates High Waisted Bikini Bottoms,$75.00,5,1,alexxandra,"San Francisco, CA ",23,5,So flattering,"LOVE these! I got the S (5'5, 118) and it fits very comfortably. Not super tight but stays up- so happy with these!",True to Size / As Expected
https://www.shopbop.com/reviews/brand?folderID=5090&baseIndex=30,Wayfarer Plunge Neck Dress,$347.50,5,1,gracer,"Seattle, WA",10,5,Love this Dress!,"I'm 5'2"" normally 110lbs but I'm now pregnant and weigh more around 118lbs these days! The print is so sweet and the material is very comfortable. A little bit more sheer than expected but with nude undergarments totally fine. Can't wait to wear this on my upcoming vacation with my bump. Think it will be totally wearable post bump as well!",True to Size / As Expected
https://www.shopbop.com/reviews/brand?folderID=5090&baseIndex=30,Separates Cross Back One Piece,$132.50,3,1,cocoloco2,India,117,3,Not worth the price,I've been eyeing this swimsuit for some time. It seemed like a very flattering cut but the sizing seems a bit off. The material is extremely thin and there is no lining on the chest area. The stomach area is cut a bit loose and has some extra fabric that wrinkles and looks unflattering (despite pulling the back ties tightly) Definitely not worth the price. ,Larger than Expected
https://www.shopbop.com/reviews/brand?folderID=5090&baseIndex=30,Scarf Bodice Top,$212.50,4,1,Romana,Chicago ,338,4,Size up,"Zimmerman, if you're familiar with the brand, runs very small. I always order up two whole sizes with this designer. I bought the Pearl-colored top in a size 2, and it was the right size. Beautiful and elegant. I lucked out with the last blouse available. 

Shopbop, however, delivered it in such a poor manner. The silk blouse was rolled up in a ball, in a plastic bag, without any care or concern for the material. It arrived needing a visit to the dry cleaners. Awful shipment procedure... not sure why they're failing with packaging and delivery in the last year. Designer coats/dresses do not come with garment bags for at least a year now. Silk blouses are rolled in a ball and put in a plastic bag. Terrible. They need to revert back to their old high-standard policies of packaging, shipping, and providing excellent customer service. ",Smaller than Expected
https://www.shopbop.com/reviews/brand?folderID=5090&baseIndex=30,Strapless Drape Maxi Dress,$136.50,2.5,2,Valichka,Chicago,1,1,Too small!!!!!!!,Doesn't worth those money. The top is much smaller then bottom. Don't buy this dress you will be disappointed.  I returned it two times by trying different sizes. ,Smaller than Expected
https://www.shopbop.com/reviews/brand?folderID=5090&baseIndex=30,Melody Off Shoulder Top,$177.50,5,1,MRINO,Dubai,5,5,The perfect pair,"This top is beautiful and you have to buy the matching shorts because as a set it looks amazing.  I was surprised by the sizing though because I had to go 2 sizes up than my normal size.  I normally wear a 0 in top but after trying a size 1 as well, I ended up with a size 2 which is a little loose but much more comfortable. ",Smaller than Expected
https://www.shopbop.com/reviews/brand?folderID=5090&baseIndex=30,Lovelorn Crochet Bikini,$78.00,5,1,zoe707,global trotter,1,5,LOVE!!!!!,"Exactly what I was looking for. Nice fabric, true to size, great design. Couldn't be happier with the order! ",True to Size / As Expected
https://www.shopbop.com/reviews/brand?folderID=5090&baseIndex=30,Pintuck Slip Dress,$237.50,5,1,marns89,"NYC,NY",184,5,Beautiful dress!,I'm a size 8 and bought this in a size 2 (fits size 6-8) and it fits perfectly. Love that the straps are adjustable. Beautifully made dress. ,True to Size / As Expected
https://www.shopbop.com/reviews/brand?folderID=5090&baseIndex=30,Goldentime Pointed Flats,$172.50,1,1,rupertandchristina,"Scottsdale, Arizona",11,1,Total Garbage,These were already falling apart when I opened the box before even trying them on. After trying them on they looked even cheaper. 99% of the time things I order from shopbop are awesome but these were completely different than pictured and horrible.,True to Size / As Expected
https://www.shopbop.com/reviews/brand?folderID=5090&baseIndex=30,Golden Plisse Mini Dress,$525.00,5,1,LizOda,"New York, NY",3,5,Splurge! - You Wont Regret It,This dress is worth every penny. You can never go wrong with Zimmerman. Be mindful of the v-neck when sizing!,True to Size / As Expected
https://www.shopbop.com/reviews/brand?folderID=5090&baseIndex=30,Separates Fixed Tri Bra,$43.50,2,1,Anna94,TX,1,2,Not worth the money,"It's a basic bra top that's extra pricey for the quality, Zimmermann had it on sale like two months ago but it sold out really fast so I couldn't get it, and I don't get why it's still full-priced here",True to Size / As Expected
https://www.shopbop.com/reviews/brand?folderID=5090&baseIndex=30,Melody High Waist Bikini Bottoms,$63.00,2,1,ewark,Toronto,1,2,Fits smaller,This bottom fits much smaller than Zimmermann's normal bathing suit bottoms. I would highly recommend going a size up in this. Top fits true to size.,Smaller than Expected
https://www.shopbop.com/reviews/brand?folderID=5090&baseIndex=30,Tie Side Bikini Bottoms,$52.00,4,1,Black velvet rose ,"Oslo, Norway",253,4,Great bikini bottoms,Zimmerman is quality. Period. Always. 4 stars because the sizing is larger than expected. ,Larger than Expected
https://www.shopbop.com/reviews/brand?folderID=5090&baseIndex=30,Strapless Draped Maxi Dress,$70.00,2.5,3,LoganChristine,Los Angeles,4,2,$350 and not Doubled Lined?,"I bought this as an option to wear as a bridesmaid dress for my cousins wedding and I was so disappointed when I received this. It was incredibly thin, so thin that you could see my NUDE thong through it! For a $350 dress I would have expected it to be at least lined. It was also very long and would definitely need to be hemmed (I'm 5'5"") which would bring about another charge.  I would not recommend this dress. ",Larger than Expected
https://www.shopbop.com/reviews/brand?folderID=5090&baseIndex=30,Helm Eyelet Vine Blouse,$336.00,5,1,The Moptop,Portland ,1,5,SO STUNNING,This top is worth the investment. It's so beautiful and a classic piece I will be wearing for years to come! ,
https://www.shopbop.com/reviews/brand?folderID=5090&baseIndex=30,Wrap Flounce Dress,$297.50,4,2,I_WEAR_PRADA,washington DC,30,3,"Nice dress, terrible condition","Arrived in a tiny plastic bag, every inch of the dress wrinkled! And with such style, and a $600 price tag - it should be perfect! Not prepared to spend time ironing.  But if you are, it's a flattering cut, will look great with over-the-knee boots.",True to Size / As Expected
https://www.shopbop.com/reviews/brand?folderID=5090&baseIndex=45,Wrap Flounce Dress,$297.50,4,2,chikaboom,"Miami, FL",16,5,Gorgeous but color is not as pictured,"This dress has a stunning, unusual chartreuse color.  The satin is gorgeous and very old Hollywood.  I would say this is more of a greenish color than mustard for sure but very unusual and beautiful.  ",True to Size / As Expected
https://www.shopbop.com/reviews/brand?folderID=5090&baseIndex=45,Jasper Tie Dress,$212.00,5,1,Rocky Mountain Chic,CANADA,27,5,Summer wedding dress,"Perfect dress for summer wedding/bridal shower.  Fits snug around my torso, I don't think you could wear a bra with it so might be better for us small chested ladies.  I saw Jules Hough wearing this with a jean jacket, so cute!",True to Size / As Expected
https://www.shopbop.com/reviews/brand?folderID=5090&baseIndex=45,Paradiso Embroidered Blouse,$144.00,3,1,RobynA,FL,3,3,Way too voluminous,"I wanted this so bad.  Stalked it until it went on sale.  But it is just way too much material in the body.  I got a 0...I wear a 2-4 in regular sizes.  Everything in the upper body was perfect.  The body of the top just needs to be trimmed down.  It is much fuller than appears in the photos.  The photo also looks like a lighter, French Blue than in person.  It is a true navy blue. ",Larger than Expected
https://www.shopbop.com/reviews/brand?folderID=5090&baseIndex=45,Sueded Drape Bodice Dress,$174.00,1,1,kris17,"boston,ma",1,1,VERY disappointed,"I am a big shopbop fan, but receiving this dress and seeing the lack of quality was really disappointing. Its expensive! I ordered a 1/sm (like I usually do) and it wouldn't even zip. ",
https://www.shopbop.com/reviews/brand?folderID=5090&baseIndex=45,Divinity Ruffle Dress,$398.00,5,1,m5611,"New York,  NY",1,5,Amazing,This dress is even more beautiful in person. True to size. I  received so many compliments on this dress when I wore it. I absolutely love it!,True to Size / As Expected
https://www.shopbop.com/reviews/brand?folderID=5090&baseIndex=45,Aerial Crochet Bra Bikini,$164.50,5,1,Doc Tash,"NY, NY",18,5,Always could use a new bikini,"I didn't want to spend so much on a bikini, but it is a great purchase.   So comfortable.   Love the look with the crochet on top.  Floral print is also beautiful.",True to Size / As Expected
https://www.shopbop.com/reviews/brand?folderID=5090&baseIndex=45,V Strapless Jumpsuit,$249.00,5,1,Romana,Chicago ,338,5,Gorgeous,"Beautiful jumpsuit, but it does run small! I'm usually a 0 in most designers, and needed a 1 or 2 in this jumpsuit, as the chest was too small to even zip. Because I sized up, the hem was a bit longer than ideal, so I had it tailored! Well worth it!",Smaller than Expected
https://www.shopbop.com/reviews/brand?folderID=5090&baseIndex=45,Silk Curve Long Dress,$148.50,2,1,shopbbop,NYC,4,2,too small around back,"i am typically a size 2 or 4, and tried this in both size 0 and 1. neither would zip around my back! also, the material is VERY thin and does not hold you in at ALL.Expected much better with such a pricey silk dress!",Smaller than Expected
https://www.shopbop.com/reviews/brand?folderID=5090&baseIndex=45,Caravan Embroidered Day Dress,$318.00,5,1,Nortii,Saudi Arabia - Jeddah,1,5,Dresses,Nothing spiceal,True to Size / As Expected
https://www.shopbop.com/reviews/brand?folderID=5090&baseIndex=45,Zephyr Broderie Dress,$159.00,5,1,CESF,"Irvine, CA",4,5,Amazing Dress,I love this dress so much.  It is so flattering and well made.  Zimmermann has been my go-to designer when I need a great dress and when I can find something on sale!  ,True to Size / As Expected
https://www.shopbop.com/reviews/brand?folderID=5090&baseIndex=45,Silk Flutter Long Dress,$174.00,5,1,Kiki P,"san francisco, CA",1,5,great color,i loved this dress. i am a C cup and  i wore this without a bra. dress did a great job holding up my chi chis. color and fit is great. This dress looks better in person and also prettier on! Draping in front is very pretty. this dress is girly and feminine. perfect for day or night. also Im medium 5'3 and size was great. ,True to Size / As Expected
https://www.shopbop.com/reviews/brand?folderID=5090&baseIndex=45,Roza Broderie Day Dress,$367.50,3,1,S.K.W.,"Nashville, TN",226,3,Okay,This dress wasn't as cute on me as it is the model - I wear a size 6 and got a size 2 which seemed to be too slightly too big which was probably part of the problem. I also though it looked odd across my chest - it may look better if you have a smaller cup size.,Larger than Expected
https://www.shopbop.com/reviews/brand?folderID=5090&baseIndex=45,Eden Embroidered Top,$240.00,4,1,Ribbons,HK,3,4,A very pretty blouse.,I like it very much especially the color and lace.,Smaller than Expected
https://www.shopbop.com/reviews/brand?folderID=5090&baseIndex=45,Sueded Flounce Dress,$240.00,5,1,debleb,Indiana,7,5,Lovely dress.,Beautiful color. Beautiful fabric. ,True to Size / As Expected
https://www.shopbop.com/reviews/brand?folderID=5090&baseIndex=45,Zephyr Button Shorts,$126.00,5,1,candy cane sugarpop,"New York, New York",3,5,Top of the line nautical shorts,"These shorts are so cute, stylish and fits to perfection. Pairs well with a white long sleeved cotton blouse. I purchased a size 1, I usually wear a US size 4. If you wear US size 6 you may want to try a Zimmermann size 2.",True to Size / As Expected
https://www.shopbop.com/reviews/brand?folderID=5090&baseIndex=60,Sakura Embroidery Dress,$805.00,3,2,KIM55,TAIWAN,1,5,LOVE!!!,I love this dress! very beautiful !!,True to Size / As Expected
