URL,Product Name,Price,Overall Rating,Overall # of Reviews,User,Location,# of User Reviews,User Rating,Rating Title,Rating Description,Sizing
https://www.shopbop.com/reviews/brand?folderID=5090&baseIndex=105,Ruched Halter Bikini Top,$28.50,5,1,michellio,Minneapolis,40,5,LOVE THIS TOP,"This is the best swimsuit top I've ever bought (I got it in black).  Its supportive, comfortable, and stylish.  I'm a 34DD and got a Large, so it runs true to size.  You can definitely go swimming in this thing!  The only downside is when sunbathing the front knot is kind of uncomfortable.",True to Size / As Expected
https://www.shopbop.com/reviews/brand?folderID=5090&baseIndex=105,Roamer Cupcake Cover Up Dress,$237.50,1,1,dede310,310 ,1,1,this will make you LOOK like a cupcake ,This dress was HUGE and made me look like a CUPCAKE !!!! OMG Very nice fabric but for the price even- not worth it. ,Larger than Expected
https://www.shopbop.com/reviews/brand?folderID=5090&baseIndex=105,Sundance Embroidered Playsuit,$237.00,4,1,Dr. LC,"Newport Beach, California",244,4,"Looks Sweet, but Is Sophisticated","I love Zimmermann swimwear though this is the first item of clothing I've purchased from the line. What a great first piece. I thought this was a dress -- and it looks like one - but it's actually a romper and given it's short length, it's much more feasible as shorts. It's best feature is the open back which is the perfect summer touch. I was worried the material and pattern would look ""country farm girl,"" but it's much more sophisticated than that. It's very sweet looking, but also features a fit that gives it some major va-voom. The material also didn't wrinkle hardly at all which was a pleasant surprise. You'll love this piece. Wearable; a great travel piece, too.",True to Size / As Expected
https://www.shopbop.com/reviews/brand?folderID=5090&baseIndex=105,Back Drape Dress,$98.75,4,6,sshell07,"Sherman Oaks, CA",1,2,"cute, but packaging ruined it!","the dress itself was cute, however it came incredibly rumpled as it was stuffed into a tiny plastic bag.  for the amount of money this dress cost, i would assume that the dress would come on a hanger and layer flat.  instead, it came folded several times, was inside out/upside down, so it would have to be steamed before wearing to ensure that it worked and was not damaged.  unfortunately, the dress though the fit was cute, had to be returned!",True to Size / As Expected
https://www.shopbop.com/reviews/brand?folderID=5090&baseIndex=105,Instinct Frill Triangle Bikini,$122.50,5,2,isabel_la,ITALY,1,5,Zimmermann - no more words needed,"I'm a hugeeee fan of zimmermann swim!! They got the most classy, hot, trendy and unique designs I've ever seen. Of course it's up to everybody personally, but since I've bought the first bikini I fell in love with the brand!!! I think about 3 years ago they changed the sizing (last time I bought the same size as I had before and it was way too small)...this time I got the right one ;)",True to Size / As Expected
https://www.shopbop.com/reviews/brand?folderID=5090&baseIndex=105,Navy Snake Frill One Piece,$154.00,5,1,MJ Kim ,South Korea,5,5,Best swimsuit ever! ,It' a gorgeous !  Definitely worth the price. ,True to Size / As Expected
https://www.shopbop.com/reviews/brand?folderID=5090&baseIndex=120,Instinct Frill Triangle Bikini,$122.50,5,2,Black velvet rose ,"Oslo, Norway",253,5,Incredibly beautiful bikini,"Wanted to buy this for such a long time. I'm so glad I finally got it on sale. I'm a hunter for animal print and this bikini doesn't disappoint. Classy print, vibrant colors. I love, love, love it. High prize, but excellent quality. ",True to Size / As Expected
https://www.shopbop.com/reviews/brand?folderID=5090&baseIndex=120,Back Drape Dress,$98.75,4,6,Laura2810,"Miami, FL",8,4,Amazing color but bad bit,I loved this dress on the site and I had high hopes for when it arrived. The fabric is fabulous and overall the dress fits well except for the top part where it's quite loose and hangs on the sides. Probably a size smaller would have been just right but it's unavailable on the site so I had to return it. Got size 3 but I am more of a size 2 by the looks of it. ,Larger than Expected
https://www.shopbop.com/reviews/brand?folderID=5090&baseIndex=120,Ringmaster Paperbag Dress,$172.50,3,1,K8 Dee,Chicago. Il,9,3,Too large,"The pattern on this dress is very pretty, but order one size down. It's supposed to be a loose fit, but it was really just too big at my normal size. I returned it.  ",Larger than Expected
https://www.shopbop.com/reviews/brand?folderID=5090&baseIndex=120,Frill Bandeau One Piece,$147.00,4.5,3,stephl,Singapore,24,4,Gorgeous! But not perfect,"I've been looking for a one-piece that is sexy without being too revealing to bring my kids to the pool. The ruffles are gorgeous and perfect for those with a small bust - v flattering.  The only odd thing (for which I docked one star) was the rather strange fit at the waist. I thought those things sticking out on either side of the model's waist in the picture were caused by tags but that's actually how the suit fits on me as well! Not sure if it's a sign the suit is too small at the waist or if my torso is too short.  Still, a gorgeous and sexy suit that I will keep for sure!",True to Size / As Expected
https://www.shopbop.com/reviews/brand?folderID=5090&baseIndex=120,Frill Bandeau One Piece,$147.00,4.5,3,sara low,singapore ,1,5,beautiful swim wear,"I recently bought this swim wear, once i tried on it, immediately fall in love with it, the cutting is good, fit my body like a glove! Love it...",True to Size / As Expected
https://www.shopbop.com/reviews/brand?folderID=5090&baseIndex=120,Sundance Frill Bikini,$154.00,4,1,Kari H,"Faavang, Norway",4,4,Colorful bikini,"I love this bikini, but the top is a bit small. You should not buy this item if you don't have a small bust.",True to Size / As Expected
https://www.shopbop.com/reviews/brand?folderID=5090&baseIndex=120,Good Love Plunge Dress,$156.00,5,2,Loriw,Scottsdale,4,5,Fabulous,This is  fabulous unique dress!  I love it. ,True to Size / As Expected
https://www.shopbop.com/reviews/brand?folderID=5090&baseIndex=120,Leopard Print Sneakers,$79.50,4.5,2,TChen,"Shanghai, China",2,5,Comfortable,True to size and feel comfortable!,True to Size / As Expected
https://www.shopbop.com/reviews/brand?folderID=5090&baseIndex=120,Instinct Paneled One Piece Swimsuit,$180.00,4,1,TXmermaid,"Houston, TX",2,4,cute suit,I had to return because suit ran a little large.  I ordered size small and normally wear a size 2-4.,Larger than Expected
https://www.shopbop.com/reviews/brand?folderID=5090&baseIndex=120,Silk Cotton Slash Dress,$141.00,1,1,Kluttz46,California ,4,1,Weird dress,"For as expensive as the dress is, the fabric is poor and the fit is odd. Returned!",True to Size / As Expected
https://www.shopbop.com/reviews/brand?folderID=5090&baseIndex=120,Keeper Frill Bandeau Bikini,$72.00,5,1,Sofia-Cerise,"Bristol, UK",2,5,SiZe UK 8 is Size 0,"somewhat true to size. 
GET YOUR USUAL SIZE

SIZE UK 8 32a b  is Size 0

colour is same as in pic

Great for hour glass shape.",True to Size / As Expected
https://www.shopbop.com/reviews/brand?folderID=5090&baseIndex=120,Sundance Lattice Triangle Bikini,$69.00,3.5,2,rachelbee,"New York, NY ",9,3,Cute but the top is revealing,"Love the color of this! But, the top is a little too revealing. I'm a 34 A and the lattice part of the top cuts across in a way that reveals too much! ",True to Size / As Expected
https://www.shopbop.com/reviews/brand?folderID=5090&baseIndex=120,Twist Strapless Gown,$142.50,2,1,CandyKisss,"Chevy Chase, MD",92,2,Twist Strapless Gown,"The silhouette on this dress is beautiful and the detail on the top is very flattering, even on a small chested girl like me. The color however was very bland (light pink) it was too close to my pale skin tone. The material of this dress was also extremely cheap for the price and the brand. I do love Zimmermanns designs, but this is the second one I have ordered recently and have returned based on the material alone. It looked and felt cheap.",True to Size / As Expected
https://www.shopbop.com/reviews/brand?folderID=5090&baseIndex=120,Good Love Pinafore Jumpsuit,$187.50,1,1,CandyKisss,"Chevy Chase, MD",92,1,Ruffle Jumpsuit,"This looks so great on the model but looks can be deceiving! The material of this jumpsuit is super lightweight and feels really cheap. It would be good for the beach I suppose, but is totally not worth the price. The pants part flares out way too much making it look really strange. ",True to Size / As Expected
https://www.shopbop.com/reviews/brand?folderID=5090&baseIndex=120,Triangle Bra Top,$22.50,5,1,sitkaforest,"Whistler, BC Canada",34,5,Bikini top," Good fit and true to size on this basic bikini top!
Plus love both the colors:)",True to Size / As Expected
https://www.shopbop.com/reviews/brand?folderID=5090&baseIndex=135,Sundance Lattice One Piece Swimsuit,$238.00,3,1,Lisey,"Wilmington, DE",8,3,"Beautiful, but not for me","This is a beautiful suit, bit the top didn't fit me, it seemed to pull my breasts down, too$$ to keep",True to Size / As Expected
https://www.shopbop.com/reviews/brand?folderID=5090&baseIndex=135,Frill Bandeau One Piece,$147.00,4.5,3,Tutter,"Washington, D.C. ",1,5,Cute One Piece,"This is a very comfortable and stylish bathing suit. I initially ordered a size 1, but because I have a long torso, I found I needed to order a size up. The size increase made the top a little big, but it's not noticeable with the ruffle.  I've received a lot of compliments on this swim suit. ",True to Size / As Expected
https://www.shopbop.com/reviews/brand?folderID=5090&baseIndex=135,Leopard Print Sneakers,$79.50,4.5,2,Kouchary,Australia. Sydney,25,4,Love the leopard ,True to size and well made ,True to Size / As Expected
https://www.shopbop.com/reviews/brand?folderID=5090&baseIndex=135,Good Love Plunge Dress,$156.00,5,2,tinker,South Africa,1,5,love this but...,"This is a very pretty dress, in fact its gorgeous. Luckily I am a very small size 0 and can fit it but normally with a size 0 I need to alter it, so be careful when ordering this dress I recommend a size up if you are true to your size or have large bust. ",Smaller than Expected
https://www.shopbop.com/reviews/brand?folderID=5090&baseIndex=135,Draped Dress,$93.00,4,5,Rosie5432,Maryland,1,2,Strange draping,"I was really excited about this dress.  The top of the dress fit well, although it was more low cut than I expected.  But the draping at the hips was awkward.  It billowed out too much on either side and didn't fall right.",True to Size / As Expected
https://www.shopbop.com/reviews/brand?folderID=5090&baseIndex=135,Honour Cats Eye Dress,$208.50,5,1,Morena,"St. Petersburg, Russia",22,5,Amazing dress,"I've never had any clothing by Zimmmermann before. My first try to buy this dress was a failure because following the dimensions of the model I chose a size 1. And it was too big (I'm 85-67-94). So I had to reorder in 0 and the fit was just right. I recommend to adhere to manufacturer size chart rather than follow SB size and fit info.
As a whole dress is fabulous and in my opinion not so pricy considering its good quality and beautiful cut.",True to Size / As Expected
https://www.shopbop.com/reviews/brand?folderID=5090&baseIndex=135,Drifter Mismatch Bikini,$92.50,4,1,KD10,Chicago,2,4,Good suit,"I liked the way it looked on the site more than I did in person but its still a great suit. Fits true to size and comfortable. 
",True to Size / As Expected
https://www.shopbop.com/reviews/brand?folderID=5090&baseIndex=135,One Shoulder Knot Gown,$142.50,5,1,Liv007,Hong Kong,12,5,Gorgeous Dress,"This dress is absolutely stunning. It is not a hard black, but a softer, washed silk black. The sizing is a bit hard to predict - I am usually a S or US 4, 27 in jeans, and the 1 fitted well in the bodice but was too tight in the under skirt part, but the 2 was a LOT bigger, although from the measurements given on the website you wouldn't think it was so much bigger. Gorgeous dress, definitely worth the price.",Smaller than Expected
https://www.shopbop.com/reviews/brand?folderID=5090&baseIndex=135,Celestial Embroidered Romper,$147.50,5,1,nellie imber,"Wollongong, NSW, Australia",13,5,gorgeous for spring,"love this zimmermann romper
i bought the size 2, AUS 10, US 6, it is a relaxed fit so little larger than your average size Aus10.
fabric is lovely and the romper is super comfy. Great with both flats and heels. Only negative is the white short section is a touch see through but skin coloured undies work fine :)",Larger than Expected
https://www.shopbop.com/reviews/brand?folderID=5090&baseIndex=135,Underwire Bikini Top,$34.50,5,1,Ginelle,"Toronto, Ontario ",36,5,So cute!,This was probably one of my best purchases. Good quality and so cute on. Very true to size as well.,True to Size / As Expected
https://www.shopbop.com/reviews/brand?folderID=5090&baseIndex=135,Low Link Bikini Bottoms,$22.50,5,1,Ginelle,"Toronto, Ontario ",36,5,Cute,I was very pleased with this purchase. True to size and uber cute :),True to Size / As Expected
https://www.shopbop.com/reviews/brand?folderID=5090&baseIndex=135,Shoestring Maxi Dress,$103.50,1,1,kikiTO,Toronto Ontario,14,1,Poorly constructed.,"This dress was incredibly disappointing. For starters, it is described as ""unlined"", which made me assume the fabric must be the sort of rich, weighty silk which doesn't need to be lined. In reality, the dress IS lined -- partially. It has a cheap nylon lining which ends at mid-thigh and is very visible through the skirt as the silk itself is quite sheer. This makes the dress look cheap and tacky. Also the lining has a bizarre double seam under the bust which shows though the silk as well.

The pink colour of the dress is beautiful, as are the straps and neckline...if the silk were higher quality OR if the dress was properly and fully lined, it would be gorgeous. As it is, the price of this dress is insane for the low quality. Maybe the black would be better (show the construction less), but in pink it's just awful. ",True to Size / As Expected
https://www.shopbop.com/reviews/brand?folderID=5090&baseIndex=135,Low Bikini Bottoms,$18.00,5,1,dwang,"Los Angeles, CA",4,5,Perfect,"Flattering, fits true to size, perfect amount of coverage and comfortable. What else can you ask for in a bikini bottom? ",True to Size / As Expected
https://www.shopbop.com/reviews/brand?folderID=5090&baseIndex=135,Celestial Frill Triangle Bikini,$120.00,5,2,shop_bop_addict,48323,5,5,Love,Loved this bikini! I thought it fit pretty well. The top is adjustable so that helps a lot. I also loved the ruffles on the top because it was really flattering for a small chest. Really cool and different! Buy it!,True to Size / As Expected
https://www.shopbop.com/reviews/brand?folderID=5090&baseIndex=150,The Vase Frill Bikini,$63.00,4.5,3,shopgal,Seattle,32,5,Ready to swim,Love the suit but the fastener is a bit cheap... ,True to Size / As Expected
https://www.shopbop.com/reviews/brand?folderID=5090&baseIndex=150,The Vase Frill Bikini,$63.00,4.5,3,Carlienne MacQueen,NEW ZEALAND,3,4,Happy,"When I first saw the colour and pattern I wasn't too sure whether or not I would like it, however it is very flattering and the pattern looks good in person. 
The cut is perfect for the bottoms (I got a size 0) and the top is also the correct size however the length of the bikini top is a bit shorter than expected (possible due to the fact that I am a bit bigger than a size 0). 
Overall a very good purchase!",True to Size / As Expected
https://www.shopbop.com/reviews/brand?folderID=5090&baseIndex=150,Papillon Drape Jumpsuit Cover Up,$135.00,5,1,tonia,"Louisville, Ky",1,5,zimmermann,"size small or medium   5 feet tall   140 lbs I would love to have this item in black I want to wear this beautiful jumpsuit to the beyonce concert here in Louisville, Kentucky in December 2013. ive looked everywhere for this item after viewing it on the internet and finally found it on shopbop. I want it so bad but its saying that youre all out. im really hoping  that you get another one by December 2013. please email me if so.even if you find something similar to it but I hope its this one. if it can be found anywhere else please contact me also. I would also love to see other items that you have in different styles. I love being different and love unique styles. im a beautician here in Louisville, Kentucky and alwaya attending hair shows as well as fashion shows, concerts and plays.i love traveling. I love on line shopping for myself and others and I have two daughters that loves hair and fashion also. one here and one living in Atlanta Georgia. please keep me up on all the latest!!!",True to Size / As Expected
https://www.shopbop.com/reviews/brand?folderID=5090&baseIndex=150,Rising Floral Shift Dress,$93.00,5,3,Tyler_Oz,"Sydney, Australia",3,5,Georgeous design,I loved the fabric design even more than the photos. Fits well and isn't too bulky. Fabric is slightly sheer so you may have to wear a cami.,True to Size / As Expected
https://www.shopbop.com/reviews/brand?folderID=5090&baseIndex=150,The Vase Underwire Bikini,$69.00,3.5,2,puddel,Denmark,1,4,good,it was good but a bit small. ,Smaller than Expected
https://www.shopbop.com/reviews/brand?folderID=5090&baseIndex=150,The Vase Underwire Bikini,$69.00,3.5,2,stephwong,"Adelaide, South Australia",5,3,color didn't match,"the color of the floral top is a lot different than seen on screen (a lot darker)-it didn't seem to match well to the purple bottom in real life. the quality/material was very good. sadly, had to return it.",True to Size / As Expected
https://www.shopbop.com/reviews/brand?folderID=5090&baseIndex=150,Collision One Piece Swimsuit,$162.50,3.5,3,Fluff n Stuff,Canada,34,2,"Good bottom, bad top","I ordered the size 1.  The bottom half was perfect.  I am a size small, 120lbs, B34 bra size, I take a size 27 jeans.  The top half was ridiculous, if I bent forward or twisted around, my top half would have fallen out.  The cups are small and didnt provide much coverage.  You would need to be an A cup to have proper coverage that wasnt obscene.  There are mini straps that come with the suit to help keep the top part up, but they really didnt solve the problem.  So if you want a suit to lay around your back yard this would be fine.  However, if you will be moving around bending over and generally on the move, this is not a suit for active wear.  But beautiful material, pattern, quality, and bottom half design.",Smaller than Expected
https://www.shopbop.com/reviews/brand?folderID=5090&baseIndex=150,Locket Triangle Bikini,$72.00,5,1,AlenaS,"Moscow, Russia",26,5,Cute bikini,"Great bikini- not too ""leopard"" thx to the top but fun and sexy. Had to go for size 3 due to bigger cup (34D) - and the top fits just but bottoms quite big although due to ties can be fixed tighter. 
DO hand wash it.. As ties detailed with cute heart locks and keys they ripped stitching a little when machine washed (even placed in underwear wash bag)  ",True to Size / As Expected
https://www.shopbop.com/reviews/brand?folderID=5090&baseIndex=150,Frill Bandeau Bikini Top,$34.50,5,3,Dayna,"NY, NY",252,5,So In Love,"Gorgeous! I'm a 34B/32C and needed a size 1, but it was sold out so I purchased the 0. Yes, it was small, but definitely doable. The underwire on the top of the bikini was different, although I really liked it because it gave you extra security knowing the top would stay in place. The color is so pretty especially against olive skin. ",True to Size / As Expected
https://www.shopbop.com/reviews/brand?folderID=5090&baseIndex=150,Frill Bikini Bottoms,$21.00,5,1,Dayna,"NY, NY",252,5,So In Love,Gorgeous! These bottoms are so girly and more importantly comfortable. The color is so pretty especially against olive skin. ,True to Size / As Expected
https://www.shopbop.com/reviews/brand?folderID=5090&baseIndex=150,Lacquer Frill One Piece Swimsuit,$203.00,1,1,Love bug,Raleigh NC,14,1,Made for a giant,"Ordered this bathing suit as well as another one by a different designer....not sure on fit. This bathing suit did not fit at all. Not even close! I am 5'4"" 102 pounds and the size 0 was huge. Never had a bathing suit fit like this. There was a lot of material and felt cheap. I ended up returning and keeping the very awesome bathing suit zero mark and Maria....this bathing suit fits like a glove and you could tell it was made well. ",Larger than Expected
https://www.shopbop.com/reviews/brand?folderID=5090&baseIndex=150,Pleated Cover Up Maxi Dress,$88.50,5,1,ElegantJerseyGirl,New Joisy Shore,80,5,Lovely,Medium fits tts. Gorgeous over a bathing suit somewhere nice or with a slip as a dress with flats. 5ft 5in.did not need to hem. Well made product.,True to Size / As Expected
https://www.shopbop.com/reviews/brand?folderID=5090&baseIndex=150,Frill Underwire Bikini Top,$115.50,3,1,KatieSh,Chicago,6,3,Cups Set Far Apart,"I loved the patern of this suit and it fit well aside from the fact that the cups were set a little far apart. That may seem odd, but it was just a tiny bit off that I couldn't justify keeping it. Might try it a size down if it becomes available. ",Larger than Expected
https://www.shopbop.com/reviews/brand?folderID=5090&baseIndex=150,Celestial Tucked One Piece Swimsuit,$238.00,5,1,lovethesimplelife,Indiana,5,5,*Darling* bathing suit,"I absolutely love this bathing suit! I usually wear bikinis, but wanted to mix things up a bit and I've been looking for a cute one piece. Detail is amazing. Colors are perfect. The silver band across the waist and along the top are a great touch. It's a beautiful piece. I'm so happy I ordered this. I got a 1 and it fits perfect. I'm 126lb, 5'7. ",True to Size / As Expected
https://www.shopbop.com/reviews/brand?folderID=5090&baseIndex=150,Allure Swing Cover Up Dress,$180.00,5,1,Ekaterina_K,"Moscow, Russia",16,5,Perfect dress for the beach,"I usually wear 1 in Zimmermann and has more or less the same parameters as the model, but my height is only 1,62cm. Since the dress on the model looks huge I sized down and it was the right decision. The dress still looks oversized but it sits right. Perfect dress for the beach. ",Larger than Expected
https://www.shopbop.com/reviews/brand?folderID=5090&baseIndex=165,Celestial Frill Triangle Bikini,$120.00,5,2,Ekaterina_K,"Moscow, Russia",16,5,LOVE LOVE LOVE,"Just got the bikini. It is amazing. Looks exactly how it is on the picture. I am 1,62 cm, 34B, hips 93cm, chest 83. The top sits good. The bottom could be a biiit bigger, but i'd better lose 1 kg ",True to Size / As Expected
https://www.shopbop.com/reviews/brand?folderID=5090&baseIndex=165,Zoe Frill Bikini,$154.00,5,2,Julia Froese,Canada,8,5,Amazing Amazing Amazing,"So I love Zimmermann, this is my second bikini from them and it's so beautiful. Really love the bottoms. Nice and low but moderate coverage on the back. I am also going to buy a cheap pair of red bottoms as I think that will look great with the bandeau. LOVE IT! 
Perfect sizing, especially if you're small. (I'm 5'5 and 110lbs. and A/B cup)",True to Size / As Expected
https://www.shopbop.com/reviews/brand?folderID=5090&baseIndex=165,Collision One Piece Swimsuit,$162.50,3.5,3,Cquiles,Los Angeles,27,4,Gorgeous,"Such a unique, gorgeous suit and very flattering.  I found it for $100 less on another site, so returned this one, but the suit itself is gorgeous.",True to Size / As Expected
https://www.shopbop.com/reviews/brand?folderID=5090&baseIndex=165,Collision One Piece Swimsuit,$162.50,3.5,3,LParks,"Seattle, WA",6,5,Truly fabulous bathing suit,"This is the highest quality bathing suit I have ever found.  the fabric is thick, the design is flattering and flawless.  I am a 6 on top and 8/10 on bottom with a very small waist.  I bought the 3, but probably could have done the 2.  I am obsessed, cant wait to wear it!",True to Size / As Expected
https://www.shopbop.com/reviews/brand?folderID=5090&baseIndex=165,Collision Lace Underwire Bikini Top,$45.00,5,1,grigri,"Brussels, Belgium",1,5,best bikini ever,"I have the black-cream version, totaly beautifull! Perfectly executed with eye for details. I took size 2 because I have a C-cup, it works. This must be one of my best bikinis ever.  ",True to Size / As Expected
https://www.shopbop.com/reviews/brand?folderID=5090&baseIndex=165,One Shoulder Maxi Dress,$475.00,5,1,dancergal19,"Washington, DC",4,5,Beautiful,"I got this dress for a spring gala.  It is stunning, I'm so glad I ordered it.  It's even more flattering in person than how it looks online.  I am petite and narrow and usually wear a size 0 but ended up going with a 1 in this dress.  Overall the 0 fit but was uncomfortably snug in the rib cage area.  I'd recommend going up if you're in between sizes.",Smaller than Expected
https://www.shopbop.com/reviews/brand?folderID=5090&baseIndex=165,Frill Bandeau Bikini Top,$34.50,5,3,GeorgeRoss80,"New York, New York",3,5,Gorgeous!,This bikini fits perfectly and is very flattering. I wasn't sure how the top would fit due to the unusual design (underwires over the top of the bra and elastic on the bottom) but it fits snugly and doesn't feel like it will slip off in the surf like many bikinis. I got the bottoms too and they are really flattering. I can't wait to wear this. I am 175cm and 60kg and got the size 2 which is a medium. The fit is perfect,True to Size / As Expected
https://www.shopbop.com/reviews/brand?folderID=5090&baseIndex=165,Brightside Floating Underwire Bikini,$115.00,5,1,lemonie,Canada,4,5,Love it,Fits perfectly. Size 0 sounded small but glad I ordered it based on the measurements as it fits great! Looks exactly like in the pictures,True to Size / As Expected
