URL,Product Name,Price,Overall Rating,Overall # of Reviews,User,Location,# of User Reviews,User Rating,Rating Title,Rating Description,Sizing
https://www.shopbop.com/reviews/brand?folderID=5090&baseIndex=60,Sakura Embroidery Dress,$805.00,3,2,LJH1031,"Seattle, WA",37,1,Not as cute in person,This dress was not as cute in person.  It showed up crumpled and had obviously been returned by someone else.  It was extremely short on me and not flattering at all.  Returned.,True to Size / As Expected
https://www.shopbop.com/reviews/brand?folderID=5090&baseIndex=60,Lavish Bell Midi Dress,$540.00,5,1,ZKRT,"Sydney, Australia",1,5,Larger bust - size up! ,"This is a beautiful piece by Zimmermann. The fabric is gorgeous and the cut is flattering. I found this dress to be small to size in the bust area not large to size as it was mentioned. I buy a lot of Zimmermann and I have a larger bust 12E. Usually I am able to stick to my usual size but I had to size up due to the particular style of this dress which is fitted around the bust. Take this into consideration. Other than that, the dress is gorgeous and definitely worth purchasing! ",Smaller than Expected
https://www.shopbop.com/reviews/brand?folderID=5090&baseIndex=60,Separates Triangle Bikini Top,$80.00,5,1,wise woman,33498,2,5,great fit,great fit...top was just perfect coverage..loved the suit...I am short and curvey and the bottom and the top fit beautifully,True to Size / As Expected
https://www.shopbop.com/reviews/brand?folderID=5090&baseIndex=60,Epoque Tulip Bikini,$82.50,3,1,Moncia,"San Diego, CA",5,3,it's an okay looking bikini,"runs small and doesn't really look that expensive, but it is still class looking ",Smaller than Expected
https://www.shopbop.com/reviews/brand?folderID=5090&baseIndex=60,Realm Scallop Dress,$595.00,2,1,Melmelmel,"boston, MA",1,2,Tooooo sheer,There is no appropriate underwear to fit at all....just too sheer,True to Size / As Expected
https://www.shopbop.com/reviews/brand?folderID=5090&baseIndex=60,Back Drape Dress,$98.75,4,6,Michou,HONG KONG,11,4,Nice dress but packaging was horrible,"I choose beautiful blue color at my size and I liked it for the wonderful color, the bland design and the chic fabric so much  and the size also was just  as I expected but the dress was delivered in a plastic bag in a small box and too many wrinkles on it. I was very disappointed at the packaging. I can recommend for the dress if someone interested but shop bop customer service centre reflex for the packaging when they send any nice dresses as another purchasers are not happy like me. At least they need to use proper size box with a clothes hanger. I hope I can hear from the customer service center what they can do better soon for this packaging matter.  I was very disappointed at the packaging. I can recommend for the dress if someone interested but shop bop customer service centre reflex for the packaging when they send any nice dresses as another purchasers are not happy like me. At least they need to use proper size box with a clothes hanger. I hope I can hear from the customer se",True to Size / As Expected
https://www.shopbop.com/reviews/brand?folderID=5090&baseIndex=60,Crepe Lace Top,$85.00,5,2,maryrose,rocky river ohio,23,5,Beautiful top,It fits great and is perfect for a Friday night out!,True to Size / As Expected
https://www.shopbop.com/reviews/brand?folderID=5090&baseIndex=60,Crepe Lace Top,$85.00,5,2,S.K.W.,"Nashville, TN",226,5,So cute and well made.,I love this top - the fabric is really thick and well made and the lace is beautiful. Fits TTS to other Zimmermann products - I wear a 4/6 and ordered a 1 which fits perfectly. ,True to Size / As Expected
https://www.shopbop.com/reviews/brand?folderID=5090&baseIndex=60,Lace Ankle Heels,$142.50,1,1,beaches,"Charleston, SC ",3,1,Disappointing fit,"I so wanted to like these! Everything was great until I went to put the strap around my ankle- would not fit around my ankle! I usually have a problem with shoes being too loose around my ankles so this was quite surprising. For reference I'm 5'9, 132 pounds, a size 4 to 6 in clothes and a 10 in shoes. ",True to Size / As Expected
https://www.shopbop.com/reviews/brand?folderID=5090&baseIndex=60,Silk Petal Twist Dress,$109.50,3.5,3,Elie,California,83,3,"Such a great cut, such cheap fabric","The TOP of this dress is so sexy and beautifully cut, a great evening dress for someone who wants to show some breast-age. Then it devolves into a wrinkly, bulgy tulip-wrap mess that ruins the whole concept.  If I could alter the fabric into something that doesn't feel like polyester, and eliminate the weird layers at the tummy, I would buy it in multiples. 
I so want this dress to work, but it makes my top half look like a movie star and my bottom half like Home Shopping Network :(
That said...if you have awesome boobage and you want to hide some extra below the waist - this may work for you.
BTW, I'm a D-cup and while I agree this dress is all about the boob, it's not THAT naked. You could wear it at an evening wedding and it would be just on the edge of too sexy.",True to Size / As Expected
https://www.shopbop.com/reviews/brand?folderID=5090&baseIndex=60,Ticking Bonded Tulip Bikini,$94.50,4,1,Dr. LC,"Newport Beach, California",244,4,The White Bikini I've Always Wanted,"I have spent years trying on white bikinis only to repeatedly realize that even dry, they're usually somewhat transparent. Zimmermann has layered the material and fabricated the suit so that even when wet nothing is revealed. I love skimpy bikinis, but I also love those that have fuller coverage bottoms and bra-like tops. This definitely fits like a bra with good support while the bottoms ride low and are about 75% full coverage in the seat. My only complaint is that this is sold as a set; we are rarely the same size on top as we are on the bottom (5'10, 142lbs, 36DD, athletic). First, I ordered a medium (2): the bottoms fit perfectly, but the top was too small (the cup cuts across demi style) so I returned, reordering a large (3). This size fits on top, but the bottoms sag here and there. Still, it's easier to take away material than add it so the bottoms are going to the tailor. This is the second pair of Zimmermann bottoms I've tailored in order to get the ideal fit. Worth it!",Smaller than Expected
https://www.shopbop.com/reviews/brand?folderID=5090&baseIndex=60,Belle Bustier Romper,$144.00,2,1,SamSilk,"Dallas, TX",1,2,Not for busty women,"I normally wear an XS or a Size 2, so I ordered the size 0 (US size 2-4).  It fit ok on the bottom, but I am a 34D and I was spilling out of the small bra cups. The pattern was adorable and the fabric was high quality, but this romper is not meant for women with larger chests. Sadly, I had to return.",Smaller than Expected
https://www.shopbop.com/reviews/brand?folderID=5090&baseIndex=60,Alchemy Flutter Tri Bikini,$137.50,2,1,S.K.W.,"Nashville, TN",226,2,Cute idea...,"The bottoms of this suit is cute and run true to size with the Zimmermann swimsuits - (I'm a size 4/6 and ordered a size 2). I found the top triangles to be too small and not flattering at all (32DD). They are slightly padded, but offer no support. The back is cute, but the ruffles don't lay flat at all. The color is also really weird - unless you have a tan or darker skin it will make you look really washed out. Returned.",True to Size / As Expected
https://www.shopbop.com/reviews/brand?folderID=5090&baseIndex=75,Belle Bustier Dress,$317.50,3.5,2,Dr. LC,"Newport Beach, California",244,3,"Beautiful, but Too, TOO Revealing On Top","I absolutely love Zimmermann and this season their floral prints are stunning! Over the past few years I have added several pieces from this brand, mostly bikinis and dresses, to my wardrobe and I wear them season after season, impressed by the quality, tailoring and the enduring fabrication. The print is so Springy and the fit very flattering. At 5'10, 142 lbs, I ordered a large; it was very loose *almost* all over, especially in the waist, while the length was a tad longer than midi. Ultimately, it was the bustier top that made this a disappointing return: too tight (I'm 36DD) and too revealing. I know Zimmerman bills the majority of its pieces as ""cover-up,"" but given the price point I wouldn't dare get them wet, let alone with chlorine. I want to wear these pieces out and about. Even if smaller on top, I think the bustier is still overexposing. However, if I had the means to purchase this for wear only at a resort, I'd do it... but I need more versatility at this price.",Larger than Expected
https://www.shopbop.com/reviews/brand?folderID=5090&baseIndex=75,Belle Bustier Dress,$317.50,3.5,2,Dr. LC,"Newport Beach, California",244,4,"So Pretty, but Too Revealing On Top","Zimmermann is one of my favorite lines as everything from their dresses to bikinis are incredibly pretty, feminine, and almost always fit beautifully. I loved this dress, but the bustier top fit more like a bikini top attached to a dress and as such, was simply too revealing. And the price point is too high to make this only a resort vacation piece. The floral pattern is so on trend and I truly adored this piece, but I couldn't imagine myself wearing it comfortably without worrying that my breasts would be overexposed if not spilling out with a mere reach for something with my arms. If you're down with this look, I recommend sizing down. I ordered a 3 (large) and it was really loose everywhere, except the chest (5'10, 142 lbs, 36DD). I've long noticed that the sizing is inconsistent in this line (I own 1s, 2s, and 3s) so sizing down is just a suggestion.",Larger than Expected
https://www.shopbop.com/reviews/brand?folderID=5090&baseIndex=75,Silk Petal Twist Dress,$109.50,3.5,3,Soti,Australia  ,1,3,Zimmerman ,Dress was too small around the bust area & was returned last week - still waiting for refund,Smaller than Expected
https://www.shopbop.com/reviews/brand?folderID=5090&baseIndex=75,Silk Petal Twist Dress,$109.50,3.5,3,AZMS,"Atlanta, GA",6,5,Gorgeous Dress from an amazing designer!,"This is a beautiful dress that is a great ""basic"" that is a little bit more special than just your standard LBD. The cut in the front certainly makes a difference and is very attention grabbing! I am a size 4 and 32D and the size 1 fit just fine, though you might want to go up a size if you're not looking to have the focus be entirely on your breasts (which, frankly, is the point of the dress, so I would go with your ""true"" size). I originally bought this for a wedding based on how it looked on the model, but unless you are flat chested it is WILDLY inappropriate for a wedding. Great material, hangs nicely. All-in-all a great dress!",True to Size / As Expected
https://www.shopbop.com/reviews/brand?folderID=5090&baseIndex=75,Sueded Balconette Dress,$144.00,4,1,Jessica L,"Vancouver, Canada",16,4,Small Chests Only,"With the underwire and such little fabric on the chest, I wouldn't buy this dress unless you're smaller than a B cup. I'm a 32DD and the dress wouldn't even zip up the last few inches, so there's no give in the fabric.

Otherwise it hangs really nicely, I'm 5'7 and it's subtly sultry in all the right ways!",Smaller than Expected
https://www.shopbop.com/reviews/brand?folderID=5090&baseIndex=75,Rhythm Smock Top,$294.00,4,1,Huguette,"Mississauga, Ontario, Candada",1,4,Great blouse,Love this blouse.  Fits beautifully.  The only problem is that many of the buttons have fallen off.  Otherwise great blouse.  ,True to Size / As Expected
https://www.shopbop.com/reviews/brand?folderID=5090&baseIndex=75,Ryker Lace Up Bikini,$82.50,5,1,TrishZe,"Sydney, Australia.",10,5,Winner in a Zimmerman ,"Everything you ever wanted from a bikini!!!
So comfortable in a simply stunning bikini top that won't feel like it's forever falling; sexy design throughout, front and back and bottoms in beautiful fabric and print!

Relax and swim let the tanning begin!
BEST STRAPLESS  BIKINI EVER!!",True to Size / As Expected
https://www.shopbop.com/reviews/brand?folderID=5090&baseIndex=75,Suede Tassel Loafers,$148.50,2,1,FashnRite,"Bay Area, CA",35,2,Zimmerman Tassel Suede Loafer a Hassel,"Overall the design of this Black menswear loafer with a feminine edge is flattering. The juxtaposition of suede and patent, mid-heel, and extension of tongue is slimming on. Bad news, the smell of the shoe dye does not dissipate even when left out of the box over a week. The leather sole is not well made, and would quickly wear down unless you were willing to have shoemaker reinforce it. At this price point , one would expect more quality. Lastly, this style is rampantly everywhere in a pump etc at Banana Republic.  Perhaps the designer should remain focus on their clothing design at this stage instead of branching out into another competitive and skilled arena. Kudos though the shoe was made in Brazil instead of China. ",True to Size / As Expected
https://www.shopbop.com/reviews/brand?folderID=5090&baseIndex=75,Gemma Bonded Flounce Bikini,$87.00,5,1,peggyB,"Miami, FL",43,5,super cute,"very pretty well made bathing suit, a statement piece! thick material, nice paisley colors, got size 1 and i am 34D, and wear XS in bottom. fits perfect . i usually take size 1 in top Zimmermann and 0 or xs on bottom!",True to Size / As Expected
https://www.shopbop.com/reviews/brand?folderID=5090&baseIndex=75,Marisol Bonded Peak Wire Swimsuit,$187.50,5,1,Cristinag,"New York,NY",31,5,AMAZING,"What a fantastic swimsuit. Sucks you in completely (for my fat self) And holds everything in, as it says Bonded. That's for sure. Absolutely LOVE IT!! The color Tomato is amazing on your tan self. So ladies, get the spray tan and wear this swimsuit. You will love it! Classic and will stand the test of time. ",True to Size / As Expected
https://www.shopbop.com/reviews/brand?folderID=5090&baseIndex=75,Esplanade Drape Tunic,$189.00,5,1,katiejojohnson,"Madison, Wi",220,5,Esplanade Tunic,"Beautiful dress and very flattering.  You can steam the top so that it's open and more like a V neck which is more flattering on me.  I'm 5'2"" and I didn't have to hem it so I'd say it is on the shorter side vs. longer side.  It looked like more of a true maxi on me with a wedge heel",Larger than Expected
https://www.shopbop.com/reviews/brand?folderID=5090&baseIndex=75,Gladiator Sandals,$142.50,5,1,Tounz,UAE,19,5,Fab Gladiators,"These look insanely amazing on, however it's a headache to put on and take off- not very functional but the design makes it worth it! Size down...",Larger than Expected
https://www.shopbop.com/reviews/brand?folderID=5090&baseIndex=75,Ankle Tie Flat Sandals,$93.00,5,1,nina1492,"Annapolis, MD",76,5,Most comfortable Sandal,"I purchased these for a month-long excursion along The Amalfi Coast. The sandals are worth every penny. I've clocked roughly 5-10 miles/day and no blisters. The easy-tie suede strap makes the sandal comfortable. I can wear them with dresses/shorts or jeans- very versatile, indeed. I wear a 7.5 and purchased the 38. ",True to Size / As Expected
https://www.shopbop.com/reviews/brand?folderID=5090&baseIndex=75,Porcelain Quilted Bikini,$175.00,5,1,beccablazek,Louisiana ,1,5,perfect!,Im a 34c and a 4 in pants and I ordered the size 2 and it fit wonderfully! My favorite thing is how there are no removable cups and instead the material is padded. This swimsuit is perfect in my opinion. Definitely makes me want to shop Zimmermann again. ,True to Size / As Expected
https://www.shopbop.com/reviews/brand?folderID=5090&baseIndex=75,Silk Diamond Tuck Dress,$123.00,5,1,camilleb,"West Hollywood, CA",1,5,perfect!,Was just what I had hoped for. Fit perfectly. Got so many compliments. The skirt/lining were a little clingy -- needed some static spray. Loved it!,True to Size / As Expected
https://www.shopbop.com/reviews/brand?folderID=5090&baseIndex=90,Draped Dress,$93.00,4,5,riee,"San Francisco, CA",74,5,PERFECT.,One of those dresses that is love at first sight. I got the rosa color and it's perfect. ,True to Size / As Expected
https://www.shopbop.com/reviews/brand?folderID=5090&baseIndex=90,Strapless Draped Maxi Dress,$70.00,2.5,3,CherylG,Virginia ,1,3,Great dress...poor packaging!,"Beautiful dress, soft, billowy, nice fabric, flattering, true to size (however, I am 5'11"" and the length is perfect.)  Now the down side,....This dress came wrinkled beyond belief in a clear cellophane wrap.  It took hours with a steamer to get the wrinkles out!!  I have never ordered anything online before that arrived in that condition.  There was no tissue or packing material what-so-ever:o)",True to Size / As Expected
https://www.shopbop.com/reviews/brand?folderID=5090&baseIndex=90,Ceramic Pinafore Romper,$308.00,2,1,Dr. LC,"Newport Beach, California",244,2,Unwearable,"Zimmermann is a pricier line and the quality fabrication and materials, in addition to the beautiful designs, often make its pieces worth their price. I have several ""cover-ups,"" including another romper, from this line and they are totally wearable far beyond the beach and poolside. This romper, with its sweet pattern and cute cut, looked like a great piece, but when it arrived, I was surprised to find that the shorts were slit, on each side, completely up to the waist, making it unwearable. And considering its price point and the thin cotton material, I wouldn't want either chlorine or saltwater on this. It was a no question, same day it arrived, return,",True to Size / As Expected
https://www.shopbop.com/reviews/brand?folderID=5090&baseIndex=90,Trinity Wide Plunge Bikini,$136.50,5,1,Stacy ,Chicago,3,5,"Lovely fit, nice piece","Material and closures are very nice.  Great fit on top and bottom, even w/small chest.  Highly recommend.",True to Size / As Expected
https://www.shopbop.com/reviews/brand?folderID=5090&baseIndex=90,Racer Motor Mini Dress,$172.50,1.5,2,Shant,"Sherman Oaks, CA",2,1,Terrible quality,The quality of this dress was very cheap. Looked like a $40 dress--at most. I returned this item. ,True to Size / As Expected
https://www.shopbop.com/reviews/brand?folderID=5090&baseIndex=90,Racer Motor Mini Dress,$172.50,1.5,2,NYCshoppingadict,NEW YORK CITY,9,2,Disapointed,"I was so excited about this dress! The material is cheap feeling and it does not look as high end as it does in the picture. I am 5'8, 110 and it was very big on me. it also just does not fit the way it does in the picture. 100% not worth 600$ it looks and feels like it should be from Zara.",Larger than Expected
https://www.shopbop.com/reviews/brand?folderID=5090&baseIndex=90,Silk Curve Bar Dress,$118.50,1,1,Shant,"Sherman Oaks, CA",2,1,Cheap Material,The material on the bottom portion of the dress is terrible quality. Looks very cheap. Definitely returning this item.,True to Size / As Expected
https://www.shopbop.com/reviews/brand?folderID=5090&baseIndex=90,Racer Leopard Plunge Dress,$208.50,3,1,youragf,los angeles,1,3,expensive for what it is,"I liked the cut of the dress and can see it working on both slim and curvy body types.  I'm a true 00P (in Banana Republic or Theory) and the 0 fit me just fine.  I'm also only an A cup.  But the material felt like rough, cheap polyester, not 100% silk.  The animal print is fun, but for the price, it didn't feel like an investment piece that I would keep and wear for years, so I returned it.",True to Size / As Expected
https://www.shopbop.com/reviews/brand?folderID=5090&baseIndex=90,Silk Draped Maxi Dress,$142.50,5,1,Goodhabit,"Seattle, WA",11,5,Very flattering,"This dress is incredibly flattering and well cut.  It does, however, run small around the chest.  I usually wear a dress size 2 and the size 1 (which is supposed to be equivalent to a size 4) fits perfectly.",Smaller than Expected
https://www.shopbop.com/reviews/brand?folderID=5090&baseIndex=90,Underwire Bra Top,$34.50,5,1,RoseChic,Paris,5,5,great quality,I love Zimmerman products overall and this one did not disappoint. Great quality and that blue color looked amazing on tanned skin.  ,True to Size / As Expected
https://www.shopbop.com/reviews/brand?folderID=5090&baseIndex=90,V Dress,$93.00,1,1,Judee,Australia,2,1,Huge ,"I purchased this in the red and it's a stunning color. However, the dress is massive. If you are a size 0 like I am I don't think there is point in purchasing it as it's really not flattering at all. ",Larger than Expected
https://www.shopbop.com/reviews/brand?folderID=5090&baseIndex=90,Tempo Rib Knit Skirt,$93.00,3,2,81musa,Norway,19,5,Fantastic skirt with amazing length,"I love love this skirt. I find it equally as amazing in live as it is on the model on the pictures. And I don't find it as see thru as the other reviewer does. its very ""Kim Kardashian"".",True to Size / As Expected
https://www.shopbop.com/reviews/brand?folderID=5090&baseIndex=90,Tempo Rib Knit Skirt,$93.00,3,2,Chigirl000,Chicago ,17,1,Not as pictured ,"This skirt looks amazing on the model, but when I tried it on it was extremely see-through. Any tight areas are seen through the skirt and the material looks like it's worth much less than $310.00. ",Larger than Expected
https://www.shopbop.com/reviews/brand?folderID=5090&baseIndex=90,Strapless Drape Maxi Dress,$136.50,2.5,2,sparklystarfish,"Toronto, Canada",18,4,So pretty but small on top,This dress is beautiful and the length is perfect. The only thing is the top is tight and takes some time to zip up. I wear a US size 8 and 34E bust. ,Smaller than Expected
https://www.shopbop.com/reviews/brand?folderID=5090&baseIndex=90,Back Drape Dress,$98.75,4,6,123456789,Sydney Australia ,2,5,Beautiful dress,"This dress is really beautiful on, the draping is so flattering. It can be pretty confusing to work out how it fits (which bits drape where), but if you follow the picture you will be fine. Once you work that out, it is a really beautiful dress and would probably suit all different body types and shapes. I took my normal Zimmermann size.

However, I have to agree with one of the above reviews that the Shopbop packaging is hopeless!  Mine arrived shoved in a plastic bag and completely crumpled.  I had to take it (brand new) to the dry cleaner's and pay for it to be steamed.",True to Size / As Expected
https://www.shopbop.com/reviews/brand?folderID=5090&baseIndex=105,Instinct Wrap One Piece Swimsuit,$93.00,4,1,simplefashion,"Vancouver, Canada",1,4,cute suit,"Fits nicely, just no support in the top. Would be nice if it had a shelf bra built in at least. But still a cute suit!",True to Size / As Expected
https://www.shopbop.com/reviews/brand?folderID=5090&baseIndex=105,Racer Asymmetrical Draped Dress,$187.50,2,1,dyla,san francisco,14,2,Wonky fit,"I love the pattern of the fabric and the asymmetrical hem, but the fit of this dress was very off on me.  The sash across the front looked bulky and unflattering.  I wish it did not have the sash.",True to Size / As Expected
https://www.shopbop.com/reviews/brand?folderID=5090&baseIndex=105,Paisley Triangle Bra Top,$25.50,5,1,Keep it chic ,"Moscow, Russian Federation",12,5,great bikini,Great quality as always from Zimmerman. Flattering. Happy with purchase. Note that the colours are darker than shown on the photo.,Larger than Expected
https://www.shopbop.com/reviews/brand?folderID=5090&baseIndex=105,Paisley Low Link Bikini Bottoms,$25.50,5,1,Keep it chic ,"Moscow, Russian Federation",12,5,great bikini,Great quality as always from Zimmerman. Flattering. Happy with purchase. Note that the colours are darker than shown on the photo.,True to Size / As Expected
https://www.shopbop.com/reviews/brand?folderID=5090&baseIndex=105,Sundance Lattice Triangle Bikini,$69.00,3.5,2,Black velvet rose ,"Oslo, Norway",253,4,"Stylish, but very tiny","I love Zimmermann and have several pieces. This bikini is fabulous, but very small and doesn't cover much. The color is more of an orange than a yellow. But it's unique and extraordinary. ",Smaller than Expected
https://www.shopbop.com/reviews/brand?folderID=5090&baseIndex=105,Verano Floral Cover Up Dress,$275.00,5,1,heyday,Hong kong,10,5,so pretty,"I know Zimmermann always brings out gorgeous cover up dresses and swimming suits as well.
This is another beautiful one so I am glad that i got it!
Although size 0 is not XS but still works.",Larger than Expected
https://www.shopbop.com/reviews/brand?folderID=5090&baseIndex=105,Silk Shaped Wire Draped Dress,$118.50,4.5,2,Izzie,Toronto,99,4,Stunning but too small in the chest area,"This is one of the most beautiful dresses I've ever tried on. Based on the review, I thought it would be perfect since I am large in the chest but as beautiful as the bottom was, the top was way too small and the larger size was not available - I looked everywhere for it. It's a rare mis of sexy and classy. I loved it so much that I showed it to my neighbour, who is smaller chested than me and she bought it off me right away - It looked amazing on her.",Smaller than Expected
https://www.shopbop.com/reviews/brand?folderID=5090&baseIndex=105,Silk Shaped Wire Draped Dress,$118.50,4.5,2,eta28,los angeles ca,10,5,Genius! ,"The built in bra is simply genius... Genius! 
I pass on so many sexy dresses because they have no support and you can't wear a bra with them. This dress eliminates the need to figure out a bra situation. Cut short but not too short. Heavy silk hides minor imperfections in the bum area. The bra offers real support with underwire. 

Fits true to size. 5'8"", 130lbs, 32c, fuller hips, and the small fits perfectly.  My husband's eyes popped out of their sockets when I walked out in this. I'm so excited about this dress :)",True to Size / As Expected
https://www.shopbop.com/reviews/brand?folderID=5090&baseIndex=105,Tamer Petal Tulip Dress,$204.00,2,1,MBossy,NYC,74,2,Unflattering Dress!,"Love Zimmermann but this one is a miss.  The proportions were outrageous and it wasn't flattering at all.  For those of you with curves, this is a tricky one to pull off.  ",Larger than Expected
